{
  "schema_version": 1,
  "kind": "RouteSnapshot",
  "side": "before",
  "versions": {
    "terminal_adapter": "1.0",
    "parser": "1.2",
    "normalizer": "1.1",
    "section_adapter": "1.0"
  },
  "sources": [
    {
      "id": "leaf03",
      "device": "leaf03",
      "side": "before",
      "path": "tests/fixtures/nxos/route_diff/synthetic/leaf03-before-route.txt",
      "sha256": "sha256:9033e87a093122c6c6c726244bdcabeb04a812675168e477131860c406828d45",
      "normalized_sha256": "sha256:9033e87a093122c6c6c726244bdcabeb04a812675168e477131860c406828d45",
      "raw_size": 167,
      "selected_range": {
        "start_line": 1,
        "end_line": 5
      },
      "mapping": [
        {
          "normalized_line": 1,
          "raw_start_line": 1,
          "raw_end_line": 1,
          "raw_start_byte": 0,
          "raw_end_byte": 30
        },
        {
          "normalized_line": 2,
          "raw_start_line": 2,
          "raw_end_line": 2,
          "raw_start_byte": 30,
          "raw_end_byte": 64
        },
        {
          "normalized_line": 3,
          "raw_start_line": 3,
          "raw_end_line": 3,
          "raw_start_byte": 64,
          "raw_end_byte": 98
        },
        {
          "normalized_line": 4,
          "raw_start_line": 4,
          "raw_end_line": 4,
          "raw_start_byte": 98,
          "raw_end_byte": 159
        },
        {
          "normalized_line": 5,
          "raw_start_line": 5,
          "raw_end_line": 5,
          "raw_start_byte": 159,
          "raw_end_byte": 167
        }
      ],
      "commands": [
        {
          "command_id": "route_ipv4_all_vrfs",
          "family": "ipv4",
          "vrf": null,
          "command": "show ip route vrf all",
          "evidence": {
            "source_id": "leaf03",
            "start_line": 1,
            "end_line": 1,
            "start_byte": 0,
            "end_byte": 30
          },
          "acquisition_evidence": {
            "header": null,
            "prompt": {
              "source_id": "leaf03",
              "start_line": 1,
              "end_line": 1,
              "start_byte": 0,
              "end_byte": 30
            },
            "body": {
              "source_id": "leaf03",
              "start_line": 2,
              "end_line": 4,
              "start_byte": 30,
              "end_byte": 159
            },
            "block": {
              "source_id": "leaf03",
              "start_line": 1,
              "end_line": 4,
              "start_byte": 0,
              "end_byte": 159
            },
            "declared_status": null,
            "collected_at": null,
            "transport": null,
            "completion_kind": "next_prompt",
            "completion_evidence": {
              "source_id": "leaf03",
              "start_line": 5,
              "end_line": 5,
              "start_byte": 159,
              "end_byte": 167
            },
            "manifest_record_sha256": null
          }
        }
      ],
      "diagnostics": [],
      "versions": {
        "terminal_adapter": "1.0",
        "parser": "1.2",
        "normalizer": "1.1",
        "section_adapter": "1.0"
      },
      "input_format": "nxos-transcript",
      "container_format": "plain-transcript",
      "notices": []
    },
    {
      "id": "leaf02",
      "device": "leaf02",
      "side": "before",
      "path": "tests/fixtures/nxos/route_diff/synthetic/leaf02-before-route.txt",
      "sha256": "sha256:5e9e3936f3c7ad7f0ec647cbbe52dd12f76f137a23325b98504ca57b9ecbd4ff",
      "normalized_sha256": "sha256:5e9e3936f3c7ad7f0ec647cbbe52dd12f76f137a23325b98504ca57b9ecbd4ff",
      "raw_size": 467,
      "selected_range": {
        "start_line": 1,
        "end_line": 18
      },
      "mapping": [
        {
          "normalized_line": 1,
          "raw_start_line": 1,
          "raw_end_line": 1,
          "raw_start_byte": 0,
          "raw_end_byte": 30
        },
        {
          "normalized_line": 2,
          "raw_start_line": 2,
          "raw_end_line": 2,
          "raw_start_byte": 30,
          "raw_end_byte": 62
        },
        {
          "normalized_line": 3,
          "raw_start_line": 3,
          "raw_end_line": 3,
          "raw_start_byte": 62,
          "raw_end_byte": 95
        },
        {
          "normalized_line": 4,
          "raw_start_line": 4,
          "raw_end_line": 4,
          "raw_start_byte": 95,
          "raw_end_byte": 96
        },
        {
          "normalized_line": 5,
          "raw_start_line": 5,
          "raw_end_line": 5,
          "raw_start_byte": 96,
          "raw_end_byte": 129
        },
        {
          "normalized_line": 6,
          "raw_start_line": 6,
          "raw_end_line": 6,
          "raw_start_byte": 129,
          "raw_end_byte": 162
        },
        {
          "normalized_line": 7,
          "raw_start_line": 7,
          "raw_end_line": 7,
          "raw_start_byte": 162,
          "raw_end_byte": 202
        },
        {
          "normalized_line": 8,
          "raw_start_line": 8,
          "raw_end_line": 8,
          "raw_start_byte": 202,
          "raw_end_byte": 203
        },
        {
          "normalized_line": 9,
          "raw_start_line": 9,
          "raw_end_line": 9,
          "raw_start_byte": 203,
          "raw_end_byte": 211
        },
        {
          "normalized_line": 10,
          "raw_start_line": 10,
          "raw_end_line": 10,
          "raw_start_byte": 211,
          "raw_end_byte": 243
        },
        {
          "normalized_line": 11,
          "raw_start_line": 11,
          "raw_end_line": 11,
          "raw_start_byte": 243,
          "raw_end_byte": 275
        },
        {
          "normalized_line": 12,
          "raw_start_line": 12,
          "raw_end_line": 12,
          "raw_start_byte": 275,
          "raw_end_byte": 308
        },
        {
          "normalized_line": 13,
          "raw_start_line": 13,
          "raw_end_line": 13,
          "raw_start_byte": 308,
          "raw_end_byte": 309
        },
        {
          "normalized_line": 14,
          "raw_start_line": 14,
          "raw_end_line": 14,
          "raw_start_byte": 309,
          "raw_end_byte": 346
        },
        {
          "normalized_line": 15,
          "raw_start_line": 15,
          "raw_end_line": 15,
          "raw_start_byte": 346,
          "raw_end_byte": 382
        },
        {
          "normalized_line": 16,
          "raw_start_line": 16,
          "raw_end_line": 16,
          "raw_start_byte": 382,
          "raw_end_byte": 458
        },
        {
          "normalized_line": 17,
          "raw_start_line": 17,
          "raw_end_line": 17,
          "raw_start_byte": 458,
          "raw_end_byte": 459
        },
        {
          "normalized_line": 18,
          "raw_start_line": 18,
          "raw_end_line": 18,
          "raw_start_byte": 459,
          "raw_end_byte": 467
        }
      ],
      "commands": [
        {
          "command_id": "route_ipv4_all_vrfs",
          "family": "ipv4",
          "vrf": null,
          "command": "show ip route vrf all",
          "evidence": {
            "source_id": "leaf02",
            "start_line": 1,
            "end_line": 1,
            "start_byte": 0,
            "end_byte": 30
          },
          "acquisition_evidence": {
            "header": null,
            "prompt": {
              "source_id": "leaf02",
              "start_line": 1,
              "end_line": 1,
              "start_byte": 0,
              "end_byte": 30
            },
            "body": {
              "source_id": "leaf02",
              "start_line": 2,
              "end_line": 8,
              "start_byte": 30,
              "end_byte": 203
            },
            "block": {
              "source_id": "leaf02",
              "start_line": 1,
              "end_line": 8,
              "start_byte": 0,
              "end_byte": 203
            },
            "declared_status": null,
            "collected_at": null,
            "transport": null,
            "completion_kind": "next_prompt",
            "completion_evidence": {
              "source_id": "leaf02",
              "start_line": 9,
              "end_line": 9,
              "start_byte": 203,
              "end_byte": 211
            },
            "manifest_record_sha256": null
          }
        },
        {
          "command_id": "route_ipv6_all_vrfs",
          "family": "ipv6",
          "vrf": null,
          "command": "show ipv6 route vrf all",
          "evidence": {
            "source_id": "leaf02",
            "start_line": 10,
            "end_line": 10,
            "start_byte": 211,
            "end_byte": 243
          },
          "acquisition_evidence": {
            "header": null,
            "prompt": {
              "source_id": "leaf02",
              "start_line": 10,
              "end_line": 10,
              "start_byte": 211,
              "end_byte": 243
            },
            "body": {
              "source_id": "leaf02",
              "start_line": 11,
              "end_line": 17,
              "start_byte": 243,
              "end_byte": 459
            },
            "block": {
              "source_id": "leaf02",
              "start_line": 10,
              "end_line": 17,
              "start_byte": 211,
              "end_byte": 459
            },
            "declared_status": null,
            "collected_at": null,
            "transport": null,
            "completion_kind": "next_prompt",
            "completion_evidence": {
              "source_id": "leaf02",
              "start_line": 18,
              "end_line": 18,
              "start_byte": 459,
              "end_byte": 467
            },
            "manifest_record_sha256": null
          }
        }
      ],
      "diagnostics": [],
      "versions": {
        "terminal_adapter": "1.0",
        "parser": "1.2",
        "normalizer": "1.1",